{
  "$schema": "../schema/intrate-portal.schema.json",
  "id": "intrate-portal",
  "title": "Cauze intrate pe instanță în 2025, măsurate din dosarele publicate",
  "publisher": "Ministerul Justiției — portal.just.ro (ECRIS), față de CSM Anexa 1",
  "period": "2025",
  "provenance": {
    "source": "portal-just-ro",
    "locator": "dosare înregistrate în 2025, numărate pe instanță din serviciul web portalquery.just.ro; volumul comparat vine din instante-2025.json",
    "confidence": "derived",
    "note": "Volumul CSM este stoc plus intrate, deci nu este aceeași mărime cu numărul de cauze intrate. Raportul dintre ele este un prag de jos, nu o cotă."
  },
  "an": 2025,
  "acoperire": {
    "instanteCsm": 241,
    "instanteCrawlate": 240,
    "acoperireDinRaport": true,
    "instantePereche": 239,
    "intrateTotal": 1310349,
    "volumCsmTotal": 3661504,
    "doarInCsm": [
      "Înalta Curte de Casație și Justiție",
      "Tribunalul Militar TIMIŞOARA"
    ],
    "doarInPortal": [
      "CURTEAMILITARADEAPELBUCURESTI"
    ]
  },
  "tiers": [
    {
      "tier": "curte-de-apel",
      "instante": 15,
      "intrate": 85271,
      "volumCsm": 198556,
      "intratePerVolum": 0.4295
    },
    {
      "tier": "judecatorie",
      "instante": 175,
      "intrate": 983040,
      "volumCsm": 2738025,
      "intratePerVolum": 0.359
    },
    {
      "tier": "tribunal",
      "instante": 49,
      "intrate": 242038,
      "volumCsm": 724923,
      "intratePerVolum": 0.3339
    }
  ],
  "courts": [
    {
      "name": "Judecătoria SECTORUL 1 BUCUREŞTI",
      "tier": "judecatorie",
      "intrate": 46473,
      "volumCsm": 88345,
      "solutionateCsm": 52258,
      "intratePerVolum": 0.526,
      "cotaIntrate": 0.035466,
      "cotaVolum": 0.024128,
      "divergentaCota": 0.011338
    },
    {
      "name": "Judecătoria TIMIŞOARA",
      "tier": "judecatorie",
      "intrate": 37662,
      "volumCsm": 70762,
      "solutionateCsm": 45990,
      "intratePerVolum": 0.5322,
      "cotaIntrate": 0.028742,
      "cotaVolum": 0.019326,
      "divergentaCota": 0.009416
    },
    {
      "name": "Judecătoria BUFTEA",
      "tier": "judecatorie",
      "intrate": 32987,
      "volumCsm": 71220,
      "solutionateCsm": 34465,
      "intratePerVolum": 0.4632,
      "cotaIntrate": 0.025174,
      "cotaVolum": 0.019451,
      "divergentaCota": 0.005723
    },
    {
      "name": "Judecătoria SECTORUL 2 BUCUREŞTI",
      "tier": "judecatorie",
      "intrate": 30867,
      "volumCsm": 61978,
      "solutionateCsm": 43631,
      "intratePerVolum": 0.498,
      "cotaIntrate": 0.023556,
      "cotaVolum": 0.016927,
      "divergentaCota": 0.006629
    },
    {
      "name": "Judecătoria SECTORUL 3 BUCUREŞTI",
      "tier": "judecatorie",
      "intrate": 30419,
      "volumCsm": 70232,
      "solutionateCsm": 43442,
      "intratePerVolum": 0.4331,
      "cotaIntrate": 0.023214,
      "cotaVolum": 0.019181,
      "divergentaCota": 0.004033
    },
    {
      "name": "Judecătoria CLUJ-NAPOCA",
      "tier": "judecatorie",
      "intrate": 27227,
      "volumCsm": 58800,
      "solutionateCsm": 33292,
      "intratePerVolum": 0.463,
      "cotaIntrate": 0.020778,
      "cotaVolum": 0.016059,
      "divergentaCota": 0.004719
    },
    {
      "name": "Judecătoria CRAIOVA",
      "tier": "judecatorie",
      "intrate": 26057,
      "volumCsm": 61116,
      "solutionateCsm": 41094,
      "intratePerVolum": 0.4264,
      "cotaIntrate": 0.019886,
      "cotaVolum": 0.016692,
      "divergentaCota": 0.003194
    },
    {
      "name": "Judecătoria CONSTANŢA",
      "tier": "judecatorie",
      "intrate": 24652,
      "volumCsm": 63071,
      "solutionateCsm": 42282,
      "intratePerVolum": 0.3909,
      "cotaIntrate": 0.018813,
      "cotaVolum": 0.017225,
      "divergentaCota": 0.001588
    },
    {
      "name": "Judecătoria SECTORUL 5 BUCUREŞTI",
      "tier": "judecatorie",
      "intrate": 22260,
      "volumCsm": 58806,
      "solutionateCsm": 39525,
      "intratePerVolum": 0.3785,
      "cotaIntrate": 0.016988,
      "cotaVolum": 0.016061,
      "divergentaCota": 0.000927
    },
    {
      "name": "Judecătoria BAIA MARE",
      "tier": "judecatorie",
      "intrate": 19972,
      "volumCsm": 26970,
      "solutionateCsm": 19193,
      "intratePerVolum": 0.7405,
      "cotaIntrate": 0.015242,
      "cotaVolum": 0.007366,
      "divergentaCota": 0.007876
    },
    {
      "name": "Judecătoria SECTORUL 4 BUCUREŞTI",
      "tier": "judecatorie",
      "intrate": 19787,
      "volumCsm": 51875,
      "solutionateCsm": 41866,
      "intratePerVolum": 0.3814,
      "cotaIntrate": 0.015101,
      "cotaVolum": 0.014168,
      "divergentaCota": 0.000933
    },
    {
      "name": "Judecătoria SECTORUL 6 BUCUREŞTI",
      "tier": "judecatorie",
      "intrate": 18963,
      "volumCsm": 41977,
      "solutionateCsm": 28373,
      "intratePerVolum": 0.4517,
      "cotaIntrate": 0.014472,
      "cotaVolum": 0.011464,
      "divergentaCota": 0.003007
    },
    {
      "name": "Judecătoria FOCŞANI",
      "tier": "judecatorie",
      "intrate": 16520,
      "volumCsm": 41411,
      "solutionateCsm": 28085,
      "intratePerVolum": 0.3989,
      "cotaIntrate": 0.012607,
      "cotaVolum": 0.01131,
      "divergentaCota": 0.001297
    },
    {
      "name": "Judecătoria PITEŞTI",
      "tier": "judecatorie",
      "intrate": 16284,
      "volumCsm": 40351,
      "solutionateCsm": 25562,
      "intratePerVolum": 0.4036,
      "cotaIntrate": 0.012427,
      "cotaVolum": 0.01102,
      "divergentaCota": 0.001407
    },
    {
      "name": "Judecătoria PLOIEŞTI",
      "tier": "judecatorie",
      "intrate": 16106,
      "volumCsm": 42585,
      "solutionateCsm": 30553,
      "intratePerVolum": 0.3782,
      "cotaIntrate": 0.012291,
      "cotaVolum": 0.01163,
      "divergentaCota": 0.000661
    },
    {
      "name": "Judecătoria ARAD",
      "tier": "judecatorie",
      "intrate": 15268,
      "volumCsm": 30604,
      "solutionateCsm": 24621,
      "intratePerVolum": 0.4989,
      "cotaIntrate": 0.011652,
      "cotaVolum": 0.008358,
      "divergentaCota": 0.003294
    },
    {
      "name": "Judecătoria BACĂU",
      "tier": "judecatorie",
      "intrate": 15143,
      "volumCsm": 35966,
      "solutionateCsm": 23622,
      "intratePerVolum": 0.421,
      "cotaIntrate": 0.011556,
      "cotaVolum": 0.009823,
      "divergentaCota": 0.001734
    },
    {
      "name": "Judecătoria ORADEA",
      "tier": "judecatorie",
      "intrate": 14840,
      "volumCsm": 33934,
      "solutionateCsm": 23049,
      "intratePerVolum": 0.4373,
      "cotaIntrate": 0.011325,
      "cotaVolum": 0.009268,
      "divergentaCota": 0.002057
    },
    {
      "name": "Tribunalul ILFOV",
      "tier": "tribunal",
      "intrate": 14565,
      "volumCsm": 24762,
      "solutionateCsm": 10761,
      "intratePerVolum": 0.5882,
      "cotaIntrate": 0.011115,
      "cotaVolum": 0.006763,
      "divergentaCota": 0.004353
    },
    {
      "name": "Tribunalul CONSTANŢA",
      "tier": "tribunal",
      "intrate": 14560,
      "volumCsm": 27089,
      "solutionateCsm": 15404,
      "intratePerVolum": 0.5375,
      "cotaIntrate": 0.011112,
      "cotaVolum": 0.007398,
      "divergentaCota": 0.003713
    },
    {
      "name": "Tribunalul IAŞI",
      "tier": "tribunal",
      "intrate": 14249,
      "volumCsm": 25547,
      "solutionateCsm": 15087,
      "intratePerVolum": 0.5578,
      "cotaIntrate": 0.010874,
      "cotaVolum": 0.006977,
      "divergentaCota": 0.003897
    },
    {
      "name": "Judecătoria CORNETU",
      "tier": "judecatorie",
      "intrate": 13730,
      "volumCsm": 48350,
      "solutionateCsm": 25315,
      "intratePerVolum": 0.284,
      "cotaIntrate": 0.010478,
      "cotaVolum": 0.013205,
      "divergentaCota": -0.002727
    },
    {
      "name": "Judecătoria TURDA",
      "tier": "judecatorie",
      "intrate": 13615,
      "volumCsm": 19049,
      "solutionateCsm": 12363,
      "intratePerVolum": 0.7147,
      "cotaIntrate": 0.01039,
      "cotaVolum": 0.005203,
      "divergentaCota": 0.005188
    },
    {
      "name": "Tribunalul TIMIŞ",
      "tier": "tribunal",
      "intrate": 13148,
      "volumCsm": 24714,
      "solutionateCsm": 12521,
      "intratePerVolum": 0.532,
      "cotaIntrate": 0.010034,
      "cotaVolum": 0.00675,
      "divergentaCota": 0.003284
    },
    {
      "name": "Judecătoria GIURGIU",
      "tier": "judecatorie",
      "intrate": 13026,
      "volumCsm": 36234,
      "solutionateCsm": 22326,
      "intratePerVolum": 0.3595,
      "cotaIntrate": 0.009941,
      "cotaVolum": 0.009896,
      "divergentaCota": 4.5e-05
    },
    {
      "name": "Judecătoria BOTOŞANI",
      "tier": "judecatorie",
      "intrate": 13017,
      "volumCsm": 36703,
      "solutionateCsm": 20794,
      "intratePerVolum": 0.3547,
      "cotaIntrate": 0.009934,
      "cotaVolum": 0.010024,
      "divergentaCota": -9e-05
    },
    {
      "name": "Tribunalul DOLJ",
      "tier": "tribunal",
      "intrate": 12543,
      "volumCsm": 24902,
      "solutionateCsm": 13342,
      "intratePerVolum": 0.5037,
      "cotaIntrate": 0.009572,
      "cotaVolum": 0.006801,
      "divergentaCota": 0.002771
    },
    {
      "name": "Judecătoria BUZĂU",
      "tier": "judecatorie",
      "intrate": 12503,
      "volumCsm": 34175,
      "solutionateCsm": 23632,
      "intratePerVolum": 0.3659,
      "cotaIntrate": 0.009542,
      "cotaVolum": 0.009334,
      "divergentaCota": 0.000208
    },
    {
      "name": "Curtea de Apel CRAIOVA",
      "tier": "curte-de-apel",
      "intrate": 12486,
      "volumCsm": 16105,
      "solutionateCsm": 10797,
      "intratePerVolum": 0.7753,
      "cotaIntrate": 0.009529,
      "cotaVolum": 0.004398,
      "divergentaCota": 0.00513
    },
    {
      "name": "Judecătoria TÂRGU MUREŞ",
      "tier": "judecatorie",
      "intrate": 11520,
      "volumCsm": 25799,
      "solutionateCsm": 19937,